{
  "schemaVersion": "1.0",
  "key": "tool_call_accuracy",
  "name": "Tool Call Accuracy",
  "category": "agentic-process",
  "version": "1.2.0",
  "description": "Composite of tool selection, input accuracy, output utilisation, call success, and tool efficiency. Aggregates 5 sub-LLM judges into a single score representing the agent's tool-use quality.",
  "costTier": "Medium",
  "higherIsBetter": true,
  "defaultThreshold": 0.7,
  "expectedInputs": [
    {
      "kind": "query",
      "key": "",
      "required": true,
      "description": "The user's request that triggered the tool calls."
    },
    {
      "kind": "response",
      "key": "",
      "required": true,
      "description": "The agent's final response."
    },
    {
      "kind": "toolCalls",
      "key": "",
      "required": true,
      "description": "The sequence of tool invocations the agent made, including arguments and results. When no tool-call data was captured no sub-judge is called, and the composite cannot pass."
    },
    {
      "kind": "expectedActions",
      "key": "",
      "required": false,
      "description": "The case's expected actions (top-level EvalInput.ExpectedActions); their required tools are sent to the tool-selection judge."
    }
  ],
  "recommendedVisualization": "radar",
  "compatibleWith": [
    {
      "system": "foundry",
      "uri": "azureai://built-in/evaluators/tool_call_accuracy"
    }
  ],
  "links": {
    "documentation": "/docs/benchmarks/agentic/getting-started.md#tool-call-accuracy",
    "source": "src/AgentEval.Evals.Agentic/Process/ToolCallAccuracyAggregateEval.cs"
  }
}
