{
  "schemaVersion": "1.0",
  "key": "groundedness",
  "name": "Groundedness",
  "category": "rag",
  "version": "1.1.0",
  "description": "Composite of 4 sub-LLM-judges checking whether each claim in the response is grounded in the provided context (no hallucinations).",
  "costTier": "Medium",
  "higherIsBetter": true,
  "defaultThreshold": 0.85,
  "expectedInputs": [
    {
      "kind": "response",
      "key": "",
      "required": true,
      "description": "Agent response."
    },
    {
      "kind": "context",
      "key": "",
      "required": true,
      "description": "Retrieved context the response should be grounded in."
    }
  ],
  "recommendedVisualization": "radar",
  "compatibleWith": [
    {
      "system": "foundry",
      "uri": "azureai://built-in/evaluators/groundedness"
    }
  ],
  "links": {
    "documentation": "/docs/benchmarks/agentic/getting-started.md#groundedness",
    "source": "src/AgentEval.Evals.Agentic/Quality/GroundednessEval.cs"
  }
}
